{
  "schema": "maintenance-superinteligence.question-benchmark.v1",
  "version": "1.0.0",
  "nature": "synthetic_editorial_regression_not_field_accuracy",
  "reviewStatus": "not_expert_validated",
  "sourceAnchor": "fmea_public_1.0.0_checksum_verified_at_runtime",
  "methodCatalogVersion": "1.0.0",
  "matrixVersion": "1.0.0",
  "fixtures": [
    {
      "fixtureId": "FD-ADDITIVES-UNKNOWN",
      "familyId": "final_drive",
      "case": {
        "schema": "maintenance-superinteligence.discrimination-case.v1",
        "caseId": "SIM-BENCH-FD-ADDITIVES-UNKNOWN",
        "familyId": "final_drive",
        "scenario": "Perfil aditivo isolado, amostra e baseline desconhecidos.",
        "evidenceNature": "simulation",
        "reportedSignals": [
          "additive_profile_changed"
        ],
        "contextStates": [],
        "oemGate": {
          "serialOrArrangement": null,
          "technicalPublication": null,
          "revision": null,
          "approved": false
        }
      },
      "expected": {
        "selectedPairId": "FD-P01",
        "selectedMethodId": "MET-OIL-PRODUCT",
        "selectionStatus": "ask_missing_context",
        "nextQuestionContains": "fluid_product_id",
        "openHypotheses": 7,
        "unresolvedPairs": 4,
        "mustAbstain": true
      },
      "editorialReviewStatus": "synthetic_regression_not_expert_validated",
      "tags": [
        "final_drive",
        "ask_missing_context"
      ],
      "note": "Perfil aditivo isolado, amostra e baseline desconhecidos."
    },
    {
      "fixtureId": "FD-FORMULATION-RECORDED",
      "familyId": "final_drive",
      "case": {
        "schema": "maintenance-superinteligence.discrimination-case.v1",
        "caseId": "SIM-BENCH-FD-FORMULATION-RECORDED",
        "familyId": "final_drive",
        "scenario": "Troca de óleo narrada no exercício; identidade de amostra incerta.",
        "evidenceNature": "simulation",
        "reportedSignals": [
          "lubricant_change_documented"
        ],
        "contextStates": [
          {
            "key": "fluid_product_id",
            "state": "available_simulated",
            "sourceRef": "SIM-BENCH-FD-FORMULATION-RECORDED-FLUID-PRODUCT-ID"
          },
          {
            "key": "service_record",
            "state": "available_simulated",
            "sourceRef": "SIM-BENCH-FD-FORMULATION-RECORDED-SERVICE-RECORD"
          }
        ],
        "oemGate": {
          "serialOrArrangement": null,
          "technicalPublication": null,
          "revision": null,
          "approved": false
        }
      },
      "expected": {
        "selectedPairId": "FD-P02",
        "selectedMethodId": "MET-OIL-SAMPLING",
        "selectionStatus": "ask_missing_context",
        "nextQuestionContains": "sample_chain",
        "openHypotheses": 7,
        "unresolvedPairs": 4,
        "mustAbstain": true
      },
      "editorialReviewStatus": "synthetic_regression_not_expert_validated",
      "tags": [
        "final_drive",
        "ask_missing_context"
      ],
      "note": "Troca de óleo narrada no exercício; identidade de amostra incerta."
    },
    {
      "fixtureId": "FD-SAMPLE-CONTRADICTION",
      "familyId": "final_drive",
      "case": {
        "schema": "maintenance-superinteligence.discrimination-case.v1",
        "caseId": "SIM-BENCH-FD-SAMPLE-CONTRADICTION",
        "familyId": "final_drive",
        "scenario": "Identificações simuladas de amostra mutuamente inconsistentes.",
        "evidenceNature": "simulation",
        "reportedSignals": [
          "sample_identity_disputed"
        ],
        "contextStates": [
          {
            "key": "sample_chain",
            "state": "contradicted",
            "sourceRef": "SIM-BENCH-FD-SAMPLE-CONTRADICTION-SAMPLE-CHAIN"
          }
        ],
        "oemGate": {
          "serialOrArrangement": null,
          "technicalPublication": null,
          "revision": null,
          "approved": false
        }
      },
      "expected": {
        "selectedPairId": "FD-P02",
        "selectedMethodId": "MET-OIL-SAMPLING",
        "selectionStatus": "reconcile_contradiction",
        "nextQuestionContains": "sample_chain",
        "openHypotheses": 7,
        "unresolvedPairs": 4,
        "mustAbstain": true
      },
      "editorialReviewStatus": "synthetic_regression_not_expert_validated",
      "tags": [
        "final_drive",
        "reconcile_contradiction"
      ],
      "note": "Identificações simuladas de amostra mutuamente inconsistentes."
    },
    {
      "fixtureId": "FD-SAMPLE-NOT-APPLICABLE",
      "familyId": "final_drive",
      "case": {
        "schema": "maintenance-superinteligence.discrimination-case.v1",
        "caseId": "SIM-BENCH-FD-SAMPLE-NOT-APPLICABLE",
        "familyId": "final_drive",
        "scenario": "Campo de cadeia de amostragem marcado não aplicável; precisa justificar.",
        "evidenceNature": "simulation",
        "reportedSignals": [
          "lubricant_change_documented"
        ],
        "contextStates": [
          {
            "key": "fluid_product_id",
            "state": "available_simulated",
            "sourceRef": "SIM-BENCH-FD-SAMPLE-NOT-APPLICABLE-FLUID-PRODUCT-ID"
          },
          {
            "key": "service_record",
            "state": "available_simulated",
            "sourceRef": "SIM-BENCH-FD-SAMPLE-NOT-APPLICABLE-SERVICE-RECORD"
          },
          {
            "key": "sample_chain",
            "state": "not_applicable",
            "sourceRef": "SIM-BENCH-FD-SAMPLE-NOT-APPLICABLE-SAMPLE-CHAIN"
          },
          {
            "key": "sample_point",
            "state": "available_simulated",
            "sourceRef": "SIM-BENCH-FD-SAMPLE-NOT-APPLICABLE-SAMPLE-POINT"
          },
          {
            "key": "sensor_location",
            "state": "available_simulated",
            "sourceRef": "SIM-BENCH-FD-SAMPLE-NOT-APPLICABLE-SENSOR-LOCATION"
          },
          {
            "key": "speed_context",
            "state": "available_simulated",
            "sourceRef": "SIM-BENCH-FD-SAMPLE-NOT-APPLICABLE-SPEED-CONTEXT"
          },
          {
            "key": "plug_identity",
            "state": "available_simulated",
            "sourceRef": "SIM-BENCH-FD-SAMPLE-NOT-APPLICABLE-PLUG-IDENTITY"
          },
          {
            "key": "prior_records",
            "state": "available_simulated",
            "sourceRef": "SIM-BENCH-FD-SAMPLE-NOT-APPLICABLE-PRIOR-RECORDS"
          }
        ],
        "oemGate": {
          "serialOrArrangement": null,
          "technicalPublication": null,
          "revision": null,
          "approved": false
        }
      },
      "expected": {
        "selectedPairId": "FD-P02",
        "selectedMethodId": "MET-OIL-SAMPLING",
        "selectionStatus": "review_applicability",
        "nextQuestionContains": "sample_chain",
        "openHypotheses": 7,
        "unresolvedPairs": 4,
        "mustAbstain": true
      },
      "editorialReviewStatus": "synthetic_regression_not_expert_validated",
      "tags": [
        "final_drive",
        "review_applicability"
      ],
      "note": "Campo de cadeia de amostragem marcado não aplicável; precisa justificar."
    },
    {
      "fixtureId": "FD-ALL-SIMULATED",
      "familyId": "final_drive",
      "case": {
        "schema": "maintenance-superinteligence.discrimination-case.v1",
        "caseId": "SIM-BENCH-FD-ALL-SIMULATED",
        "familyId": "final_drive",
        "scenario": "Contexto didático preenchido, mas não há teste realizado ou OEM efetivo.",
        "evidenceNature": "simulation",
        "reportedSignals": [
          "additive_profile_changed"
        ],
        "contextStates": [
          {
            "key": "fluid_product_id",
            "state": "available_simulated",
            "sourceRef": "SIM-BENCH-FD-ALL-SIMULATED-FLUID-PRODUCT-ID"
          },
          {
            "key": "service_record",
            "state": "available_simulated",
            "sourceRef": "SIM-BENCH-FD-ALL-SIMULATED-SERVICE-RECORD"
          },
          {
            "key": "sample_chain",
            "state": "available_simulated",
            "sourceRef": "SIM-BENCH-FD-ALL-SIMULATED-SAMPLE-CHAIN"
          },
          {
            "key": "sample_point",
            "state": "available_simulated",
            "sourceRef": "SIM-BENCH-FD-ALL-SIMULATED-SAMPLE-POINT"
          },
          {
            "key": "sensor_location",
            "state": "available_simulated",
            "sourceRef": "SIM-BENCH-FD-ALL-SIMULATED-SENSOR-LOCATION"
          },
          {
            "key": "speed_context",
            "state": "available_simulated",
            "sourceRef": "SIM-BENCH-FD-ALL-SIMULATED-SPEED-CONTEXT"
          },
          {
            "key": "plug_identity",
            "state": "available_simulated",
            "sourceRef": "SIM-BENCH-FD-ALL-SIMULATED-PLUG-IDENTITY"
          },
          {
            "key": "prior_records",
            "state": "available_simulated",
            "sourceRef": "SIM-BENCH-FD-ALL-SIMULATED-PRIOR-RECORDS"
          }
        ],
        "oemGate": {
          "serialOrArrangement": null,
          "technicalPublication": null,
          "revision": null,
          "approved": false
        }
      },
      "expected": {
        "selectedPairId": "FD-P01",
        "selectedMethodId": "MET-OIL-PRODUCT",
        "selectionStatus": "prepare_human_method_review",
        "nextQuestionContains": "O produto e a composição",
        "openHypotheses": 7,
        "unresolvedPairs": 4,
        "mustAbstain": true
      },
      "editorialReviewStatus": "synthetic_regression_not_expert_validated",
      "tags": [
        "final_drive",
        "prepare_human_method_review"
      ],
      "note": "Contexto didático preenchido, mas não há teste realizado ou OEM efetivo."
    },
    {
      "fixtureId": "HYD-LOAD-DISPUTED",
      "familyId": "hydraulics",
      "case": {